{
  "$schema": "https://json-schema.org/draft/2020-12/schema",
  "$id": "https://cardiology-viz.local/schemas/asset-manifest",
  "title": "Cardiology visualization content manifest",
  "type": "object",
  "required": ["contentVersion", "signedAt", "meshes", "review"],
  "properties": {
    "contentVersion": { "type": "string", "pattern": "^[0-9]+\\.[0-9]+\\.[0-9]+(-[a-zA-Z0-9.-]+)?$" },
    "signedAt": { "type": "string", "format": "date-time" },
    "meshes": {
      "type": "array",
      "items": {
        "type": "object",
        "required": ["id", "lod", "uri", "sha256"],
        "properties": {
          "id": { "type": "string", "description": "Ontology-linked node id, e.g. coronary_artery.LAD" },
          "lod": { "type": "string", "enum": ["LOD0", "LOD1", "LOD2", "LOD3"] },
          "uri": { "type": "string", "description": "Relative path or signed URL to glTF/GLB" },
          "sha256": { "type": "string", "minLength": 64, "maxLength": 64 }
        }
      }
    },
    "review": {
      "type": "object",
      "required": ["clinicalReviewer", "reviewDate"],
      "properties": {
        "clinicalReviewer": { "type": "string" },
        "reviewDate": { "type": "string", "format": "date" },
        "limitations": { "type": "string" }
      }
    }
  }
}
